3,190,0:41:17,0:43:48,3:46:19,3:48:50,Haiti,Alex,Felt sad because people she knew died; and because Haiti already had problems. Felt unreal; a nightmare. Will be a reconstruction that will extend beyond her life.,country,,,-,,,10-Jan,,Quotes about how she felt after the earthquake: unreal; like a nightmare,0:02:31,,
3,191,0:43:48,0:44:20,3:48:50,3:49:22,Haiti,Alex,Seeing the courage of haitians after the earthquake gives her hope that Haiti will regrow.,country,,,,,,2010 - 2011,,,0:00:32,,
3,192,0:44:20,0:45:37,3:49:22,3:50:39,Haiti,interviewer,Asks if she thinks there are silences in the recounting of Haiti's story.,country,,,,,,2011,,,0:01:17,,
3,193,0:45:37,0:45:50,3:50:39,3:50:52,Haiti,Alex; haitians ,Talks about nostalgia among Haitians she knows of a beautiful country; an attachment to the past,country,,,,,,<1950,reflection - no chrono,Question isn't super clear to her; it seems. I THINK this past is a pre-modern one; before the distatorships; etc. I think this can be timestamped; she is explicitly talking about a nostalgia of a haiti lost,0:00:13,,
3,194,0:45:50,0:49:05,3:50:52,3:54:07,Quebec; France; USA,Alex; haitians ,Shares her pride in haitian people for making their mark wherever they go.,region; country ,,,+,,,,reflection - no chrono,Locations that she emphasizes where haitians have made their mark.,0:03:15,,
3,195,0:49:05,0:49:15,3:54:07,3:54:17,none,interviewer,Asks if there is anything she would like to add,,,,,,,,,,0:00:10,,
3,196,0:49:15,0:50:53,3:54:17,3:55:55,none,Alex,Shares final words: always learn; learn to love; don't get bitter; share.,,,,,,,,reflection - no chrono,,0:01:38,,
,,,,,,,,,,,,,,,,,,3:55:55,0:25:49,0:09:52
